{"candidate_artifact":{"path":"tests/fixtures/discovery/proposals.valid.jsonl","row_count":4,"schema_version":"partizan.candidate_proposal.v0.1","sha256":"a22ce17e5fc3f4ebfd5e7a9d81a2ecea5f82f4bb1ea08b50608050558dd5c467"},"determinism":{"artifact_sha256":"a22ce17e5fc3f4ebfd5e7a9d81a2ecea5f82f4bb1ea08b50608050558dd5c467","byte_identical":true,"operation":"canonicalization","run_count":2},"generator":{"config_sha256":"8e0cbdf3fae684ad14df833313c33cdbe5210f57e0f2eb91f03f9d4d93030a6b","name":"astralbase_discovery_fixture_generator","random_seed":0,"version":"0.1.0"},"pool_id":"pool-sha256:4b71fafa31508ddcb71b542788459e700bbb524b3854ac280a823f21aac48004","ranker_boundary":{"allowed_proposal_paths":["/position","/proposal_features"],"allowed_target_paths":["/ranker_view"],"audit_passed":true,"contract_id":"proposal_only_ranker_input_v0.1","generation_phase":"offline_before_any_verifier_call"},"schema_version":"partizan.candidate_pool_manifest.v0.1","source_repositories":{"astralbase":"5f999e72f68510b800abc462dabc06785c6a79a6","bitmesh":"ade3417a007b9c8392d8a153abc4b3ed23edf0aa","partizan":"ba77fd03294f71cc8e1136ea1b7f04245d974ae8","thermograph":"1d9b6b01c3921aca8c2a8fb13972fee8a4de5041"},"target_ref":{"sha256":"cda3d37a135c8df5a416411e224d71f4693e9e6ecc44defc47048275ba3d68b9","target_id":"target-sha256:c22a73801f2e855ec21de33b9e10c3023683b196bdcc05566eb8bf4a4feb9fe8"}}
